{
  "candidate_version": "1.0.0",
  "generated_at": "2026-07-11T04:11:43.938131Z",
  "mode": "dry_run",
  "source_adapter_summary_path": "D:\\mep_quotation_pipeline\\feasibility_outputs\\profile_write_adapter_dry_run\\profile_write_adapter_summary.json",
  "write_target": "write_candidate_preview_only",
  "ready_for_write_to_main_pipeline": false,
  "summary": {
    "candidate_items_count": 3,
    "skipped_items_count": 0,
    "duplicate_write_key_count": 0,
    "duplicate_material_code_count": 0,
    "proposed_status": "READY_FOR_HUMAN_COMMIT_REVIEW",
    "ready_for_write_to_main_pipeline": false,
    "reasons_not_ready_for_write": [
      "Chưa có chữ ký số hoặc Human Approval duyệt file Excel Controlled Commit."
    ]
  },
  "candidates": [
    {
      "write_candidate_id": "WRITE_CANDIDATE_0001",
      "source_adapter_item_id": "PROFILE_20260710_001_ITEM_0001",
      "supplier_code": "CHINT",
      "material_code": "NXM-63S",
      "description": "MCCB Chint NXM-63S 3P 25÷63 25",
      "unit": "cái",
      "quantity": 1.0,
      "unit_price": 800000,
      "amount": 800000.0,
      "currency": "VND",
      "page_number": 3,
      "write_key": "CHINT|NXM-63S|P3|800000|MCCBCHINTNXM63S3P256325",
      "human_decision": "APPROVE",
      "human_note": "",
      "provenance": "Source PDF: Bảng giá Chint 1-3-2023 ck 50.pdf, Page: 3, Layout: chint_mccb_nxm_nm1, Method: coordinate_column_profiler",
      "evidence_text": "25÷63 25 NXM-63S 800,000",
      "proposed_action": "INSERT_CANDIDATE"
    },
    {
      "write_candidate_id": "WRITE_CANDIDATE_0002",
      "source_adapter_item_id": "PROFILE_20260710_001_ITEM_0002",
      "supplier_code": "CHINT",
      "material_code": "NXM-125S",
      "description": "MCCB Chint NXM-125S 3P 80÷125 25",
      "unit": "cái",
      "quantity": 1.0,
      "unit_price": 860000,
      "amount": 860000.0,
      "currency": "VND",
      "page_number": 3,
      "write_key": "CHINT|NXM-125S|P3|860000|MCCBCHINTNXM125S3P801252",
      "human_decision": "APPROVE",
      "human_note": "",
      "provenance": "Source PDF: Bảng giá Chint 1-3-2023 ck 50.pdf, Page: 3, Layout: chint_mccb_nxm_nm1, Method: coordinate_column_profiler",
      "evidence_text": "80 ÷ 125 25 NXM-125S 860,000",
      "proposed_action": "INSERT_CANDIDATE"
    },
    {
      "write_candidate_id": "WRITE_CANDIDATE_0003",
      "source_adapter_item_id": "PROFILE_20260710_001_ITEM_0003",
      "supplier_code": "CHINT",
      "material_code": "NXM-250S",
      "description": "MCCB Chint NXM-250S 3P 160,200,250 35",
      "unit": "cái",
      "quantity": 1.0,
      "unit_price": 1400000,
      "amount": 1400000.0,
      "currency": "VND",
      "page_number": 3,
      "write_key": "CHINT|NXM-250S|P3|1400000|MCCBCHINTNXM250S3P160200",
      "human_decision": "APPROVE",
      "human_note": "",
      "provenance": "Source PDF: Bảng giá Chint 1-3-2023 ck 50.pdf, Page: 3, Layout: chint_mccb_nxm_nm1, Method: coordinate_column_profiler",
      "evidence_text": "160,200,250 35 NXM-250S 1,400,000",
      "proposed_action": "INSERT_CANDIDATE"
    }
  ],
  "warnings": []
}
